{
  "version": 1,
  "id": "release-001",
  "title": "Implement the first complete product increment",
  "objective": "Deliver the ordered GitHub Issues as one coherent, independently verifiable release.",
  "parentIssue": null,
  "issues": [
    {
      "number": 101,
      "order": 1,
      "dependsOn": [],
      "objective": null,
      "acceptanceCriteria": [
        "The data model described by Issue #101 is implemented.",
        "Relevant unit tests are added or updated."
      ],
      "suggestedValidation": [
        { "command": "npm test -- --runInBand model", "timeoutMs": 900000 }
      ],
      "allowNoop": false
    },
    {
      "number": 102,
      "order": 2,
      "dependsOn": [101],
      "objective": null,
      "acceptanceCriteria": [
        "The service behavior in Issue #102 uses the model introduced by #101.",
        "Error paths are covered."
      ],
      "suggestedValidation": [],
      "allowNoop": false
    },
    {
      "number": 103,
      "order": 3,
      "dependsOn": [102],
      "objective": null,
      "acceptanceCriteria": [
        "The user-facing entry point in Issue #103 exposes the completed behavior.",
        "Documentation and tests reflect the final interface."
      ],
      "suggestedValidation": [],
      "allowNoop": false
    }
  ],
  "releaseAcceptanceCriteria": [
    "The three Issues work together as one end-to-end flow.",
    "Existing supported behavior remains backward compatible.",
    "Full repository validation passes."
  ],
  "reviewFocus": [
    "Cross-Issue data and state consistency.",
    "Error recovery and backward compatibility.",
    "Security-sensitive boundaries and missing integration tests."
  ]
}
